date,duration,exclude,text,Concept,Phrase,Segment,WC,Analytic,Clout,Authentic,Tone,WPS,BigWords,Dic,Linguistic,function,pronoun,ppron,i,we,you,shehe,they,ipron,det,article,number,prep,auxverb,adverb,conj,negate,verb,adj,quantity,Drives,affiliation,achieve,power,Cognition,allnone,cogproc,insight,cause,discrep,tentat,certitude,differ,memory,Affect,tone_pos,tone_neg,emotion,emo_pos,emo_neg,emo_anx,emo_anger,emo_sad,swear,Social,socbehav,prosocial,polite,conflict,moral,comm,socrefs,family,friend,female,male,Culture,politic,ethnicity,tech,Lifestyle,leisure,home,work,money,relig,Physical,health,illness,wellness,mental,substances,sexual,food,death,need,want,acquire,lack,fulfill,fatigue,reward,risk,curiosity,allure,Perception,attention,motion,space,visual,auditory,feeling,time,focuspast,focuspresent,focusfuture,Conversation,netspeak,assent,nonflu,filler,AllPunc,Period,Comma,QMark,Exclam,Apostro,OtherP,Emoji
6/11/24 12:46,174,0,When people use the phrase meaningful I feel they are discussing something they feel deeply about. They have a lot of input for or maybe experience in this topic they are discussing. Also could be using this word as a way to attention grab to draw people into the said conversation.,Word,Meaningful,1,51,46.7,63.27,32.94,50.31,17,13.73,88.24,76.47,58.82,15.69,9.8,1.96,0,0,0,7.84,5.88,13.73,7.84,0,15.69,9.8,7.84,7.84,0,25.49,1.96,5.88,0,0,0,0,17.65,0,17.65,5.88,3.92,1.96,5.88,0,1.96,0,1.96,1.96,0,0,0,0,0,0,0,0,17.65,9.8,0,0,0,0,9.8,7.84,0,0,0,0,0,0,0,0,0,0,0,0,0,0,1.96,0,0,0,0,0,0,0,0,0,0,1.96,0,0,0,0,0,0,9.8,13.73,1.96,0,5.88,0,0,5.88,1.96,1.96,7.84,0,0,0,0,0,0,5.88,5.88,0,0,0,0,0,0
6/11/24 12:47,146,0,"The meaning of life is the answer for the ultimate question, why are we here.  This is a very personal question, with different satisfying and true answers for different people.  Are we here for the journey (and its experiences) or for some differences (what have we accomplished).",Life,MeaningOf,1,47,55.01,76.11,83.13,83.95,15.67,27.66,95.74,74.47,63.83,12.77,6.38,0,6.38,0,0,0,6.38,17.02,10.64,0,12.77,10.64,8.51,6.38,0,10.64,10.64,2.13,8.51,6.38,2.13,0,23.4,0,23.4,10.64,2.13,0,6.38,0,8.51,0,4.26,4.26,0,0,0,0,0,0,0,0,19.15,8.51,0,0,0,0,8.51,8.51,0,0,0,0,0,0,0,0,2.13,0,0,2.13,0,0,0,0,0,0,0,0,0,0,0,0,0,0,0,2.13,0,0,0,0,10.64,4.26,0,0,4.26,0,0,0,0,0,8.51,0,0,0,0,0,0,19.15,6.38,4.26,0,0,0,8.51,0
6/11/24 12:47,133,0,"When using meaning in this context, it can mean that how you interpret something. They're talking about the definition of that specific word. Usually to come to conclusion of some sorts",Word,MeaningOf,1,31,32.41,88.59,99,,10.33,29.03,96.77,74.19,61.29,22.58,6.45,0,0,3.23,0,3.23,16.13,16.13,3.23,0,19.35,6.45,12.9,3.23,0,16.13,3.23,3.23,0,0,0,0,35.48,0,35.48,19.35,6.45,3.23,9.68,0,0,0,0,0,0,0,0,0,0,0,0,0,16.13,9.68,0,0,0,0,9.68,6.45,0,0,0,0,0,0,0,0,0,0,0,0,0,0,0,0,0,0,0,0,0,0,0,0,0,0,0,0,0,0,0,0,6.45,6.45,0,3.23,6.45,0,0,0,6.45,0,6.45,0,0,0,0,0,0,12.9,6.45,3.23,0,0,3.23,0,0
6/11/24 12:45,270,0,"The simplest answer is the denotation of the word. The denotation of a word is what object, concept, or action the word stands for, or is symbolic of.  On top of this there may be a 'connotation' to any given word or, in other words, what concepts are implied by the word, a beneath the readily identifiable beneath-the-surface meaning.",Word,MeaningOf,1,59,97.84,10.17,97.35,45.75,19.67,22.03,89.83,66.1,61.02,5.08,0,0,0,0,0,0,5.08,22.03,16.95,0,16.95,10.17,3.39,5.08,0,11.86,5.08,0,0,0,0,0,20.34,0,20.34,10.17,0,0,8.47,0,6.78,0,1.69,1.69,0,0,0,0,0,0,0,0,11.86,11.86,0,0,0,0,11.86,0,0,0,0,0,0,0,0,0,0,0,0,0,0,0,0,0,0,0,0,0,0,0,0,0,0,0,0,0,0,0,0,0,0,10.17,0,1.69,8.47,0,0,0,1.69,1.69,6.78,1.69,0,0,0,0,0,22.03,5.08,10.17,0,0,3.39,3.39,0
6/11/24 12:47,133,0,"To me a meaningful life is a life with purpose and achievement, which is a subjective term. Someone who has lived a meaningful life has accomplished a handful of what they perceive as goals. This can be personal, like relationships, or career-driven.",Life,Meaningful,1,42,56.86,67.92,39.59,99,14,28.57,97.62,71.43,59.52,16.67,7.14,2.38,0,0,0,2.38,9.52,14.29,11.9,0,11.9,14.29,0,7.14,0,16.67,7.14,2.38,9.52,2.38,7.14,0,19.05,0,19.05,7.14,2.38,2.38,4.76,0,4.76,0,11.9,11.9,0,0,0,0,0,0,0,0,19.05,0,0,0,0,0,0,11.9,0,0,0,0,0,0,0,0,4.76,0,0,4.76,0,0,2.38,0,0,0,0,0,0,0,0,0,0,0,0,0,0,2.38,0,0,9.52,4.76,0,0,2.38,0,0,0,2.38,2.38,11.9,0,0,0,0,0,0,16.67,7.14,7.14,0,0,0,2.38,0
6/11/24 12:49,54,0,"I think when someone uses the phrase ""the meaning of life"" they are talking about the purpose of living. Why do we exist? Why do we do the things we do?",Life,MeaningOf,1,31,11.71,99,35.88,,10.33,12.9,93.55,83.87,70.97,22.58,16.13,3.23,9.68,0,0,3.23,6.45,12.9,12.9,0,9.68,16.13,12.9,3.23,0,29.03,0,0,9.68,9.68,0,0,22.58,0,22.58,6.45,12.9,0,3.23,0,0,0,0,0,0,0,0,0,0,0,0,0,22.58,3.23,0,0,0,0,3.23,16.13,0,0,0,0,0,0,0,0,0,0,0,0,0,0,3.23,0,0,0,0,0,0,0,0,0,0,0,0,0,0,0,0,0,3.23,3.23,0,0,3.23,0,0,0,3.23,0,6.45,0,0,0,0,0,0,16.13,3.23,0,6.45,0,0,6.45,0
6/11/24 12:48,117,0,"When people use this phrase, they are highlighting a word that has importance. They could be   referring to something they are writing and trying to find the right word for. They could also be using the phrase sarcastically to point out that someone else is saying something that is useless to them.",Word,Meaningful,1,52,4.85,88.42,1,1,17.33,17.31,92.31,80.77,67.31,23.08,9.62,0,0,0,0,9.62,13.46,13.46,5.77,0,11.54,19.23,7.69,5.77,0,26.92,3.85,0,0,0,0,0,23.08,0,19.23,0,3.85,3.85,5.77,0,1.92,0,3.85,0,3.85,1.92,0,1.92,0,0,0,0,26.92,15.38,0,0,0,1.92,11.54,11.54,0,0,0,0,0,0,0,0,0,0,0,0,0,0,0,0,0,0,0,0,0,0,0,0,0,0,0,0,0,0,0,5.77,3.85,3.85,3.85,0,0,0,0,0,1.92,0,9.62,0,0,0,0,0,0,7.69,5.77,1.92,0,0,0,0,0
6/11/24 12:47,168,0,"They probably are talking about the definition of a word. They might also be talking about a subjective interpretation of something. They might also be referring to a translation, or re-wording, of something to make it easier to understand for someone else",Word,MeaningOf,1,42,42.52,67.92,12.96,57.46,14,30.95,92.86,85.71,71.43,16.67,7.14,0,0,0,0,7.14,9.52,9.52,9.52,0,21.43,11.9,14.29,7.14,0,23.81,4.76,0,0,0,0,0,30.95,0,30.95,7.14,2.38,0,16.67,0,4.76,0,2.38,2.38,0,0,0,0,0,0,0,0,21.43,11.9,0,0,0,0,9.52,9.52,0,0,0,0,0,0,0,0,0,0,0,0,0,0,0,0,0,0,0,0,0,0,0,0,0,0,0,0,0,0,0,0,2.38,0,0,0,0,0,0,0,0,0,2.38,4.76,0,0,0,0,0,11.9,4.76,4.76,0,0,0,2.38,0
6/11/24 12:47,130,0,to point out what is conveyed by saying a particular thing. some words can have different meanings depending on the context in which its used. explaioning in which way to appy a certain word,Word,MeaningOf,1,34,95.53,2.18,67.28,,11.33,23.53,91.18,70.59,55.88,14.71,0,0,0,0,0,0,14.71,14.71,8.82,0,20.59,8.82,0,0,0,14.71,8.82,2.94,0,0,0,0,23.53,0,23.53,2.94,5.88,2.94,2.94,0,11.76,0,0,0,0,0,0,0,0,0,0,0,17.65,17.65,0,0,0,0,17.65,0,0,0,0,0,0,0,0,0,0,0,0,0,0,0,0,0,0,0,0,0,0,0,0,0,0,0,0,0,0,0,0,0,2.94,14.71,5.88,0,8.82,0,0,0,0,2.94,5.88,0,0,0,0,0,0,5.88,5.88,0,0,0,0,0,0
6/11/24 12:47,166,0,"A meaningful life to me means a sense of purpose, where you get fulfilment from living. It may not be having all your desires met, but from what you get out of it you find satisfactory. Also upon reflecting about your life, you are glad that you have one.",Life,Meaningful,1,49,22.49,99,78.4,99,16.33,12.24,97.96,85.71,67.35,24.49,16.33,2.04,0,14.29,0,0,8.16,14.29,4.08,2.04,16.33,10.2,6.12,4.08,2.04,22.45,6.12,4.08,0,0,0,0,22.45,2.04,20.41,10.2,2.04,2.04,2.04,0,4.08,0,10.2,8.16,0,4.08,2.04,0,0,0,0,0,20.41,2.04,0,0,0,0,0,14.29,0,0,0,0,0,0,0,0,0,0,0,0,0,0,2.04,0,0,0,0,0,0,0,0,0,2.04,4.08,0,2.04,0,0,0,0,14.29,14.29,0,0,8.16,2.04,0,2.04,0,2.04,4.08,2.04,0,0,0,0,0,12.24,6.12,6.12,0,0,0,0,0
6/11/24 12:47,155,0,People are often referring to something with substantial importantance or significance when they use word meaningful. It is associated with purpose also. Typically meaningful also indicates ideal.,Life,Meaningful,1,27,3.37,40.06,27.44,99,9,40.74,88.89,74.07,51.85,11.11,3.7,0,0,0,0,3.7,7.41,0,0,0,11.11,7.41,18.52,14.81,0,14.81,14.81,3.7,0,0,0,0,40.74,0,40.74,7.41,7.41,3.7,14.81,0,3.7,0,7.41,7.41,0,0,0,0,0,0,0,0,11.11,7.41,0,0,0,0,3.7,3.7,0,0,0,0,0,0,0,0,0,0,0,0,0,0,0,0,0,0,0,0,0,0,0,0,0,0,0,0,0,0,0,0,3.7,3.7,3.7,0,0,0,0,0,7.41,0,7.41,0,0,0,0,0,0,11.11,11.11,0,0,0,0,0,0
6/11/24 12:48,136,0,"thaey are talking about why we are here on earth. and talking about the ups and downs of life and what kind of effect it has on your life. also its about your morals and how you go about your daily living,",Life,MeaningOf,1,42,10.19,99,56.69,,14,4.76,90.48,80.95,69.05,19.05,11.9,0,2.38,9.52,0,0,7.14,11.9,2.38,0,21.43,7.14,19.05,11.9,0,16.67,2.38,0,2.38,2.38,0,0,14.29,0,9.52,4.76,7.14,0,0,0,2.38,0,0,0,0,0,0,0,0,0,0,0,23.81,7.14,0,0,0,2.38,4.76,11.9,0,0,0,0,0,0,0,0,0,0,0,0,0,0,2.38,0,0,0,0,0,0,0,0,0,0,0,0,0,0,0,0,0,9.52,7.14,0,2.38,7.14,0,0,0,2.38,0,7.14,0,0,0,0,0,0,7.14,4.76,2.38,0,0,0,0,0
6/11/24 12:48,138,0,I think they are talking about a word that provides clarity and understanding to the person seeing it.  It likely has some association with feelings or sentiments.  It would be something that resonates and that people can interpret the meaning in a way that makes sense to them.,Word,Meaningful,1,48,31.5,52.49,39.59,,16,22.92,95.83,70.83,60.42,22.92,6.25,2.08,0,0,0,4.17,16.67,18.75,8.33,0,10.42,10.42,2.08,6.25,0,18.75,2.08,2.08,2.08,2.08,0,0,25,0,25,12.5,2.08,4.17,6.25,0,2.08,0,2.08,0,0,2.08,0,0,0,0,0,0,14.58,8.33,0,0,0,0,6.25,6.25,0,0,0,0,0,0,0,0,2.08,0,0,2.08,0,0,0,0,0,0,0,0,0,0,0,0,0,0,0,0,0,0,0,0,2.08,10.42,0,0,4.17,2.08,0,4.17,0,0,10.42,0,0,0,0,0,0,6.25,6.25,0,0,0,0,0,0
6/11/24 12:47,176,0,A meaningful word has meaning and communicates exactly what the speaker is trying to convey. A meaningful word could also mean say what you mean or speak truthfully. Some people say words but do not mean it and are being deceitful. To me a meaningful word means to speak what you truly feel and be honest.,Word,Meaningful,1,56,14.77,21.49,48.09,98.65,14,16.07,94.64,75,55.36,12.5,5.36,1.79,0,3.57,0,0,7.14,8.93,7.14,0,5.36,12.5,5.36,10.71,1.79,26.79,7.14,1.79,1.79,0,1.79,0,30.36,0,30.36,14.29,0,3.57,1.79,5.36,5.36,0,7.14,7.14,0,0,0,0,0,0,0,0,21.43,19.64,0,0,0,3.57,16.07,1.79,0,0,0,0,0,0,0,0,0,0,0,0,0,0,0,0,0,0,0,0,0,0,0,0,0,0,0,0,0,0,0,0,7.14,1.79,0,0,0,0,0,1.79,0,0,10.71,0,0,0,0,0,0,7.14,7.14,0,0,0,0,0,0
6/11/24 12:49,65,0,"The word has a connotation that particularly evokes an emotion. The definition of the word or the overall aura of the word is connected to our emotional mind. Ultimately, there is no clear meaning as ""meaning"" is subjective.",Word,Meaningful,1,38,85.45,40.06,52.19,61.63,12.67,28.95,89.47,65.79,57.89,5.26,2.63,0,2.63,0,0,0,2.63,26.32,18.42,0,10.53,10.53,7.89,5.26,2.63,10.53,7.89,0,2.63,2.63,0,0,18.42,2.63,15.79,7.89,0,0,2.63,0,2.63,0,7.89,2.63,0,5.26,0,0,0,0,0,0,13.16,7.89,0,0,0,0,7.89,2.63,0,0,0,0,0,0,0,0,0,0,0,0,0,0,0,0,0,0,0,0,0,0,0,0,0,0,0,0,0,0,0,0,2.63,5.26,0,0,5.26,0,0,0,2.63,0,10.53,0,0,0,0,0,0,15.79,7.89,2.63,0,0,0,5.26,0
6/11/24 12:46,263,0,I'd have to say the meaning of a word is it's expression of the word by using other words. Or the explanation of the meaning of the word by using other words. Or it could mean it's definition or significance.,Word,MeaningOf,1,40,89.52,1,78.67,,13.33,15,95,70,62.5,10,2.5,2.5,0,0,0,0,7.5,20,15,0,17.5,15,0,7.5,0,25,5,0,0,0,0,0,35,0,35,12.5,5,5,7.5,0,12.5,0,0,0,0,0,0,0,0,0,0,0,15,15,0,0,0,0,15,0,0,0,0,0,0,0,0,0,0,0,0,0,0,0,0,0,0,0,0,0,0,0,0,5,0,0,0,0,0,0,0,0,2.5,0,0,0,0,0,0,0,0,0,7.5,5,0,0,0,0,0,15,7.5,0,0,0,7.5,0,0
6/11/24 12:48,146,0,"How many lives can truly be said to be ""meaningful?"" Someone who does great things would most likely be considered a meaningful life. But even people who live ordinary lives can still be said to have lived a meaningful life if they live, love, care, and respect and others are impacted by their life.",Life,Meaningful,1,54,6.03,62.05,52.89,99,18,14.81,100,87.04,59.26,12.96,7.41,0,0,0,0,3.7,5.56,9.26,3.7,0,5.56,18.52,7.41,7.41,0,35.19,14.81,3.7,1.85,0,0,1.85,27.78,0,27.78,9.26,3.7,5.56,5.56,1.85,5.56,0,12.96,12.96,0,1.85,1.85,0,0,0,0,0,24.07,9.26,3.7,0,0,0,3.7,9.26,0,0,0,0,0,0,0,0,0,0,0,0,0,0,9.26,0,0,0,0,0,0,0,0,0,0,0,0,0,0,0,0,0,18.52,9.26,0,0,9.26,0,0,0,0,7.41,11.11,0,0,0,0,0,0,14.81,3.7,5.56,1.85,0,0,3.7,0
6/11/24 12:49,62,0,To me it is making the world a better place for humanity in general. It is about leaving the world in a better place than when you joined it. I feel that it is about reducing the amount of suffering and increasing the amount of pleasure in the world.,Life,Meaningful,1,49,89.52,40.06,97.09,96.32,16.33,14.29,97.96,83.67,61.22,16.33,6.12,4.08,0,2.04,0,0,10.2,16.33,14.29,0,20.41,6.12,6.12,6.12,0,16.33,6.12,6.12,6.12,2.04,4.08,0,6.12,0,6.12,2.04,2.04,0,0,0,2.04,0,10.2,8.16,2.04,4.08,2.04,2.04,0,0,0,0,4.08,0,0,0,0,0,0,4.08,0,0,0,0,0,0,0,0,0,0,0,0,0,0,0,0,0,0,0,0,0,0,0,0,0,0,0,0,0,0,0,0,10.2,20.41,0,2.04,16.33,0,0,2.04,2.04,2.04,8.16,0,0,0,0,0,0,6.12,6.12,0,0,0,0,0,0
6/11/24 12:49,96,0,"the definition of the word, more than likely. Or the interpretation. Either way, it's the basic function of the word in question. I do not know how to expand on that any further without using the word ""meaning""",Word,MeaningOf,1,38,95.09,1,99,,9.5,18.42,97.37,73.68,60.53,7.89,2.63,2.63,0,0,0,0,5.26,26.32,15.79,0,18.42,5.26,5.26,7.89,2.63,10.53,10.53,5.26,0,0,0,0,39.47,0,36.84,15.79,5.26,0,10.53,0,13.16,0,0,0,0,0,0,0,0,0,0,0,13.16,13.16,0,0,0,0,13.16,0,0,0,0,0,0,0,0,0,0,0,0,0,0,0,0,0,0,0,0,0,0,0,0,0,0,0,0,0,0,0,0,0,2.63,10.53,0,0,10.53,0,0,0,0,0,2.63,0,0,0,0,0,0,21.05,7.89,5.26,0,0,2.63,5.26,0
6/11/24 12:48,118,0,"I think they are talking about the way to have the most fulfilling, satisfying and desired life. Many people can move through life on auto pilot, and the phrase the meaning of life about getting people to understand the important parts of life. Thinking about the meaning of life is a way to describe the actual important parts of living, as opposed to unimportant things.",Life,MeaningOf,1,65,98.92,23.73,30.98,68.66,21.67,23.08,95.38,69.23,50.77,4.62,3.08,1.54,0,0,0,1.54,1.54,15.38,12.31,0,21.54,6.15,4.62,4.62,0,16.92,10.77,3.08,3.08,0,1.54,1.54,13.85,0,13.85,7.69,0,3.08,0,0,3.08,0,7.69,4.62,1.54,1.54,0,0,0,0,0,0,13.85,4.62,0,0,1.54,0,3.08,1.54,0,0,0,0,0,0,0,0,0,0,0,0,0,0,1.54,0,0,0,0,0,0,0,0,0,1.54,1.54,0,3.08,0,0,0,0,12.31,6.15,0,1.54,4.62,0,0,0,0,0,7.69,0,0,0,0,0,0,9.23,4.62,4.62,0,0,0,0,0
6/11/24 12:49,62,0,A meaningful word is something that brings a positive emotion to someone. Meaningful can make someone feel fulfilled. It can mean something that is important to you.,Word,Meaningful,1,27,16.08,97.57,10.18,99,9,37.04,100,85.19,59.26,29.63,3.7,0,0,3.7,0,0,25.93,14.81,7.41,0,7.41,14.81,0,0,0,25.93,14.81,0,3.7,0,3.7,0,40.74,0,40.74,14.81,3.7,7.41,14.81,0,0,0,14.81,11.11,0,3.7,0,0,0,0,0,0,18.52,7.41,0,0,0,0,3.7,11.11,0,0,0,0,0,0,0,0,0,0,0,0,0,0,0,0,0,0,0,0,0,0,0,0,0,0,0,3.7,0,0,0,0,11.11,7.41,0,3.7,0,0,0,3.7,0,0,22.22,0,0,0,0,0,0,11.11,11.11,0,0,0,0,0,0
6/11/24 12:48,146,0,"When people say the meaning of life, I take that to mean they are referring to what life means. In other words, they may say the meaning of life (to them) is what is important to them such as what their purpose is or what they aim to get from life. They may also mean large lessons that we all may or may not learn about life (being kind, money isn't important, etc.) which makes our life meaningful and worthwhile.",Life,MeaningOf,1,80,13.27,54.96,78.67,90.5,20,11.25,97.5,76.25,61.25,21.25,12.5,1.25,2.5,0,0,8.75,8.75,11.25,2.5,0,13.75,12.5,3.75,7.5,2.5,22.5,7.5,2.5,3.75,2.5,1.25,0,28.75,1.25,27.5,11.25,2.5,0,7.5,0,7.5,0,5,5,0,0,0,0,0,0,0,0,27.5,8.75,0,0,0,1.25,3.75,11.25,0,0,0,0,0,0,0,0,1.25,0,0,1.25,0,0,0,0,0,0,0,0,0,0,0,0,0,2.5,0,0,0,1.25,0,2.5,15,1.25,0,0,1.25,0,0,0,1.25,0,8.75,5,0,0,0,0,0,16.25,5,5,0,0,1.25,5,0
6/11/24 12:50,31,0,Having purpose and making life good for those around them. Its the idea of fmaily and friends and being good them. Its the idea that you leave a legacy,Life,Meaningful,1,29,13.62,99,21.61,98.26,9.67,6.9,93.1,68.97,62.07,24.14,10.34,0,0,3.45,0,6.9,13.79,17.24,10.34,0,10.34,13.79,3.45,10.34,0,20.69,0,0,3.45,3.45,0,0,13.79,0,13.79,6.9,6.9,0,0,0,0,0,6.9,6.9,0,6.9,6.9,0,0,0,0,0,17.24,0,0,0,0,0,0,13.79,0,3.45,0,0,0,0,0,0,0,0,0,0,0,0,0,0,0,0,0,0,0,0,0,0,0,0,0,0,0,0,0,0,10.34,6.9,0,3.45,3.45,0,0,0,0,0,6.9,0,0,0,0,0,0,13.79,6.9,0,0,0,6.9,0,0
6/11/24 12:48,160,0,"I think it means a life that is important, fulfilling and filled with purpose.  Meaniful life to me means that you are doing the right things for the right reasons. It also means leading a life that others look up too.",Life,Meaningful,1,41,34.12,26.81,75.67,58.42,13.67,14.63,97.56,73.17,58.54,24.39,7.32,4.88,0,2.44,0,0,17.07,17.07,9.76,0,9.76,7.32,4.88,4.88,0,19.51,4.88,0,4.88,0,4.88,2.44,17.07,0,17.07,12.2,4.88,0,0,0,2.44,0,2.44,2.44,0,0,0,0,0,0,0,0,9.76,0,0,0,0,0,0,2.44,0,0,0,0,0,0,0,0,0,0,0,0,0,0,0,0,0,0,0,0,0,0,0,0,0,0,0,4.88,0,0,0,4.88,12.2,7.32,4.88,0,2.44,4.88,0,0,0,0,12.2,0,0,0,0,0,0,9.76,7.32,2.44,0,0,0,0,0
6/11/24 12:48,144,0,"I believe the most synonymous term for ""meaning"" in this context is purpose.  Some people feel that there must be a reason that we exist and that it is not purely a random happening.  It implies a sense or existence or order as opposed to chaos.",Life,MeaningOf,1,46,28.85,10.88,85.35,3.88,15.33,19.57,89.13,69.57,60.87,17.39,4.35,2.17,2.17,0,0,0,13.04,21.74,8.7,0,8.7,8.7,4.35,8.7,2.17,15.22,4.35,4.35,6.52,2.17,0,4.35,30.43,0,30.43,13.04,4.35,4.35,6.52,6.52,6.52,0,2.17,0,2.17,0,0,0,0,0,0,0,4.35,2.17,0,0,2.17,0,0,2.17,0,0,0,0,0,0,0,0,0,0,0,0,0,0,0,0,0,0,0,0,0,0,0,0,0,0,0,0,0,0,0,0,4.35,8.7,0,0,4.35,0,0,4.35,2.17,0,6.52,0,0,0,0,0,0,10.87,6.52,0,0,0,0,4.35,0
6/11/24 12:48,123,0,"the definition of the word is likely the answer. Also, the meaning of a word can be the explanation of the word. Also, meaning could be the significance of a word.",Word,MeaningOf,1,31,98.66,,6.29,,10.33,16.13,96.77,67.74,64.52,0,0,0,0,0,0,0,0,29.03,29.03,0,12.9,16.13,6.45,6.45,0,16.13,3.23,0,0,0,0,0,25.81,0,25.81,16.13,0,6.45,3.23,0,0,0,0,0,0,0,0,0,0,0,0,0,16.13,16.13,0,0,0,0,16.13,0,0,0,0,0,0,0,0,0,0,0,0,0,0,0,0,0,0,0,0,0,0,0,0,0,0,0,0,0,0,0,0,0,0,0,0,0,0,0,0,0,0,0,6.45,0,0,0,0,0,0,16.13,9.68,6.45,0,0,0,0,0
6/11/24 12:47,221,0,"When people use the word ""meaning"" as in, ""the meaning of life,"" I feel like they are using the word ""meaning"" as a replacement for the word ""purpose."" Meaning and purpose have very similar definitions in this regard, and I truly believe that's the definition of ""meaning"" in this situation. ""The purpose of life"" would have the same exact meaning as ""The meaning of life.""",Life,MeaningOf,1,65,91.49,17.19,95.87,,21.67,24.62,98.46,66.15,55.38,9.23,4.62,3.08,0,0,0,1.54,4.62,18.46,13.85,0,18.46,7.69,4.62,9.23,0,13.85,4.62,0,0,0,0,0,32.31,0,32.31,16.92,7.69,1.54,0,1.54,3.08,0,0,0,0,0,0,0,0,0,0,0,12.31,6.15,0,1.54,0,0,4.62,1.54,0,0,0,0,0,0,0,0,0,0,0,0,0,0,0,0,0,0,0,0,0,0,0,0,0,0,0,0,0,0,0,0,12.31,6.15,0,0,4.62,0,0,1.54,1.54,0,4.62,0,0,0,0,0,0,32.31,4.62,4.62,0,0,1.54,21.54,0
6/11/24 12:47,201,0,I think when people use the word meaningful they are saying that something has substance and significance.  If something is meaningful it can give meaning to our lives as opposed to something that is trivial or devoid of substance.  People in contemporary society are losing a sense of meaning and purpose in their lives.,Word,Meaningful,1,54,23.88,62.05,86.01,5.19,18,27.78,92.59,74.07,55.56,18.52,7.41,1.85,1.85,0,0,3.7,11.11,11.11,3.7,0,12.96,11.11,1.85,11.11,0,24.07,5.56,0,5.56,1.85,1.85,1.85,25.93,0,25.93,11.11,3.7,1.85,9.26,0,3.7,0,9.26,3.7,5.56,0,0,0,0,0,0,0,14.81,7.41,0,0,1.85,0,3.7,7.41,0,0,0,0,0,0,0,0,0,0,0,0,0,0,3.7,0,0,0,0,0,0,0,0,0,0,0,1.85,0,0,0,1.85,0,5.56,9.26,0,0,7.41,0,0,1.85,1.85,0,16.67,0,0,0,0,0,0,5.56,5.56,0,0,0,0,0,0
6/11/24 12:49,94,0,I think this is used to show that the word used encapsulated the experience/person/thing/etc. Rather than just being a basic description it gives depth to what the word is being used for. It allows for the layers of complexity to be seen.,Word,Meaningful,1,45,77.34,27.89,10.18,,15,8.89,91.11,75.56,57.78,15.56,2.22,2.22,0,0,0,0,13.33,15.56,11.11,0,15.56,11.11,4.44,2.22,0,24.44,2.22,2.22,2.22,0,0,2.22,17.78,0,17.78,4.44,8.89,0,0,0,2.22,0,0,0,0,0,0,0,0,0,0,0,11.11,8.89,0,0,0,0,6.67,2.22,0,0,0,0,0,0,0,0,0,0,0,0,0,0,0,0,0,0,0,0,0,0,0,0,0,0,0,0,0,0,0,0,0,6.67,0,0,2.22,4.44,0,0,0,8.89,6.67,0,0,0,0,0,0,13.33,6.67,0,0,0,0,6.67,0
6/11/24 12:49,91,0,"People are talking about what is the point of all of this. Why live and move on? What is the end goal of humanity, or even just your personal goal of your time on earth? My answer is 42 given to me by the great super computer Deep Thought.",Life,MeaningOf,1,49,68.5,74.89,51.8,99,12.25,10.2,95.92,77.55,59.18,14.29,8.16,4.08,0,4.08,0,0,6.12,16.33,6.12,2.04,18.37,8.16,8.16,4.08,0,18.37,8.16,2.04,4.08,0,4.08,0,10.2,2.04,8.16,4.08,2.04,0,2.04,0,2.04,0,8.16,8.16,0,0,0,0,0,0,0,0,12.24,4.08,0,0,0,0,4.08,8.16,0,0,0,0,2.04,0,0,2.04,2.04,0,0,2.04,0,0,2.04,0,0,0,0,0,0,0,0,0,0,0,0,0,0,4.08,0,0,8.16,6.12,0,2.04,4.08,0,0,0,2.04,2.04,8.16,0,0,0,0,0,0,10.2,4.08,2.04,4.08,0,0,0,0
6/11/24 12:50,58,0,"In my opinion, when people use the phrase ""a meaningful word,"" they are referring to a word that holds significant emotional and/or intellectual weight. It conveys a deeper message or sentiment, resonating on a personal or universal level. Such a word can evoke strong feelings, memories, or thoughts, and is often used to highlight the importance of communication and expression in capturing complex human experiences.",Word,Meaningful,1,66,78.71,23.94,79.84,86.79,22,33.33,86.36,66.67,45.45,6.06,3.03,1.52,0,0,0,1.52,3.03,15.15,10.61,0,9.09,4.55,3.03,12.12,0,10.61,13.64,1.52,1.52,0,0,1.52,22.73,0,22.73,7.58,3.03,1.52,7.58,0,6.06,1.52,7.58,4.55,0,3.03,0,0,0,0,0,0,13.64,9.09,0,0,0,0,7.58,4.55,0,0,0,0,0,0,0,0,0,0,0,0,0,0,0,0,0,0,0,0,0,0,0,0,0,0,0,0,0,0,0,0,1.52,7.58,0,0,6.06,0,0,1.52,3.03,1.52,6.06,0,0,0,0,0,0,18.18,4.55,9.09,0,0,0,4.55,0
6/11/24 12:49,84,0,"A meaningful life is a life with purpose. When someone lives with purpose, they have a life with goals and expectations of achievement. Without purpose, a life is not meaningful.",Life,Meaningful,1,30,84.21,22.56,63.35,99,10,30,100,66.67,56.67,6.67,3.33,0,0,0,0,3.33,3.33,13.33,13.33,0,16.67,10,6.67,6.67,3.33,13.33,6.67,0,6.67,0,6.67,0,26.67,0,26.67,6.67,10,0,3.33,0,6.67,0,13.33,13.33,0,0,0,0,0,0,0,0,20,0,0,0,0,0,0,6.67,0,0,0,0,0,0,0,0,0,0,0,0,0,0,3.33,0,0,0,0,0,0,0,0,0,0,0,0,0,0,3.33,0,0,16.67,3.33,0,0,3.33,0,0,0,3.33,0,10,3.33,0,0,0,0,0,16.67,10,6.67,0,0,0,0,0
6/11/24 12:49,129,0,"The meaning of a word could just mean the simple definition, that you would see if you looked the work up in the dictionary. It could also refer to the different ways the word is used. Some words can have very different meanings based on context or the tone of the speaker. Or, meaning could be used to talk about how words can be used differently in different languages.",Word,MeaningOf,1,69,72.44,18.24,25.51,,17.25,17.39,92.75,76.81,59.42,5.8,2.9,0,0,2.9,0,0,2.9,15.94,13.04,0,13.04,14.49,8.7,5.8,0,26.09,5.8,1.45,1.45,0,1.45,0,34.78,0,34.78,8.7,7.25,8.7,4.35,0,10.14,0,0,0,0,0,0,0,0,0,0,0,13.04,10.14,0,0,0,0,7.25,2.9,0,0,0,0,0,0,0,0,1.45,0,0,1.45,0,0,0,0,0,0,0,0,0,0,0,0,0,0,0,0,0,0,0,0,8.7,7.25,0,0,4.35,2.9,0,0,0,5.8,4.35,0,0,0,0,0,0,8.7,5.8,2.9,0,0,0,0,0
6/11/24 12:48,169,0,"People use the word ""meaning""  in different ways. When using the phrase ""meaning"" such as ""the meaning of a word"" it means the definition of the word. It is what defines the word.",Word,MeaningOf,1,33,98.44,23.94,95.15,,11,18.18,93.94,66.67,51.52,9.09,0,0,0,0,0,0,9.09,24.24,21.21,0,12.12,3.03,3.03,6.06,0,15.15,3.03,0,0,0,0,0,27.27,0,27.27,18.18,6.06,0,0,0,3.03,0,0,0,0,0,0,0,0,0,0,0,12.12,12.12,0,0,0,0,12.12,0,0,0,0,0,0,0,0,0,0,0,0,0,0,0,0,0,0,0,0,0,0,0,0,0,0,0,0,0,0,0,0,0,3.03,3.03,0,0,3.03,0,0,0,3.03,0,9.09,0,0,0,0,0,0,27.27,9.09,0,0,0,0,18.18,0
6/11/24 12:50,69,0,"They are talking about the true nature, the true essence of the word described. A more profound or deeper look into the word being used. As some people just use words without meaning.",Word,MeaningOf,1,33,95.66,23.94,29.49,67.94,11,18.18,93.94,75.76,51.52,3.03,3.03,0,0,0,0,3.03,0,21.21,15.15,0,15.15,6.06,9.09,6.06,0,18.18,15.15,6.06,0,0,0,0,21.21,0,21.21,3.03,6.06,0,3.03,0,6.06,0,3.03,3.03,0,0,0,0,0,0,0,0,18.18,15.15,0,0,0,0,15.15,3.03,0,0,0,0,0,0,0,0,0,0,0,0,0,0,0,0,0,0,0,0,0,0,0,0,0,0,0,0,0,0,0,0,6.06,9.09,3.03,0,6.06,3.03,0,0,0,3.03,3.03,0,0,0,0,0,0,12.12,9.09,3.03,0,0,0,0,0
6/11/24 12:48,167,0,"when people use this phrase I think they are looking for words other than meaningful. They want a word that describes how meaningful whatever it is means to them. Perhaps words like precious, significant, and important are what they are looking for.",Word,Meaningful,1,42,10.19,54.27,56.69,99,14,23.81,97.62,80.95,59.52,23.81,11.9,2.38,0,0,0,9.52,11.9,9.52,2.38,0,11.9,9.52,7.14,7.14,0,23.81,14.29,0,0,0,0,0,23.81,0,23.81,11.9,4.76,2.38,2.38,0,4.76,0,9.52,9.52,0,0,0,0,0,0,0,0,19.05,9.52,0,0,0,0,9.52,9.52,0,0,0,0,0,0,0,0,0,0,0,0,0,0,0,0,0,0,0,0,0,0,0,0,2.38,0,0,0,0,0,0,9.52,4.76,9.52,9.52,0,0,9.52,0,0,2.38,0,11.9,0,0,0,0,0,0,11.9,7.14,4.76,0,0,0,0,0
6/11/24 12:46,299,0,It is about how they think the word is used in a sentence. Since there are so many different ways you can use a word to make a statement it needs to be thought out before used. The meaning of a word to me is how the sentence is perceived by other people reading the writings.,Word,MeaningOf,1,56,83.77,40.06,72.58,,18.67,16.07,91.07,80.36,64.29,8.93,5.36,1.79,0,1.79,0,1.79,3.57,17.86,14.29,0,17.86,12.5,8.93,5.36,0,26.79,5.36,1.79,0,0,0,0,26.79,0,26.79,10.71,12.5,3.57,0,0,3.57,0,0,0,0,0,0,0,0,0,0,0,8.93,5.36,0,0,0,0,5.36,3.57,0,0,0,0,0,0,0,0,0,0,0,0,0,0,0,0,0,0,0,0,0,0,0,1.79,0,0,0,0,0,0,0,0,5.36,7.14,0,0,5.36,0,0,0,3.57,3.57,12.5,0,0,0,0,0,0,5.36,5.36,0,0,0,0,0,0
