date,duration,exclude,text,Concept,Phrase,Segment,WC,Analytic,Clout,Authentic,Tone,WPS,BigWords,Dic,Linguistic,function,pronoun,ppron,i,we,you,shehe,they,ipron,det,article,number,prep,auxverb,adverb,conj,negate,verb,adj,quantity,Drives,affiliation,achieve,power,Cognition,allnone,cogproc,insight,cause,discrep,tentat,certitude,differ,memory,Affect,tone_pos,tone_neg,emotion,emo_pos,emo_neg,emo_anx,emo_anger,emo_sad,swear,Social,socbehav,prosocial,polite,conflict,moral,comm,socrefs,family,friend,female,male,Culture,politic,ethnicity,tech,Lifestyle,leisure,home,work,money,relig,Physical,health,illness,wellness,mental,substances,sexual,food,death,need,want,acquire,lack,fulfill,fatigue,reward,risk,curiosity,allure,Perception,attention,motion,space,visual,auditory,feeling,time,focuspast,focuspresent,focusfuture,Conversation,netspeak,assent,nonflu,filler,AllPunc,Period,Comma,QMark,Exclam,Apostro,OtherP,Emoji
6/11/24 12:31,458,0,"When a person says ""a meaningful word,"" they are saying that they can relate to the word. When a person says ""a meaningful word,"" they are saying that it has a lot of levels of context for example the word happy could mean a little happy, a medium amount of happy, or extremely happy. When a person says it's ""a meaningful word,"" they could be saying the word has relevance to the whole word and not just to them. The word peace would be an example of this.",Word,Meaningful,1,88,68.43,72.71,3.28,99,22,9.09,94.32,77.27,59.09,11.36,5.68,0,0,0,0,5.68,5.68,21.59,17.05,0,9.09,12.5,5.68,5.68,1.14,19.32,10.23,6.82,0,0,0,0,14.77,0,14.77,6.82,0,4.55,1.14,1.14,2.27,0,9.09,9.09,0,4.55,4.55,0,0,0,0,0,25,15.91,0,0,0,0,15.91,9.09,0,0,0,0,0,0,0,0,0,0,0,0,0,0,0,0,0,0,0,0,0,0,0,0,0,0,0,0,0,0,0,0,1.14,0,0,0,0,0,0,0,3.41,0,10.23,0,0,0,0,0,0,18.18,4.55,5.68,0,0,1.14,6.82,0
6/11/24 12:34,251,0,"When people use the phrase ""the meaning of a word"" they are looking for the definition of a word. This definition could come from a standardized dictionary. Or the definition could come from an emerging dictionary, such as the urban dictionary, if the word has come into more recent use.",Word,MeaningOf,1,50,98.41,29.01,98.38,,16.67,20,90,68,56,4,2,0,0,0,0,2,2,26,20,0,14,8,2,8,0,20,4,2,0,0,0,0,20,0,20,8,4,4,4,0,4,0,0,0,0,0,0,0,0,0,0,0,8,6,0,0,0,0,6,2,0,0,0,0,0,0,0,0,0,0,0,0,0,0,0,0,0,0,0,0,0,0,0,0,0,0,0,0,0,0,0,4,8,16,4,8,10,4,0,0,4,0,4,0,0,0,0,0,0,14,6,4,0,0,0,4,0
6/11/24 12:36,136,0,"The meaning of life is being able to have children and raise them properly.

The meaning of life is being able to properly enjoy life without worry or strain.

The meaning of life is being able to be kind to others and know that the universe will reward you properly for doing so.",Life,MeaningOf,1,53,60.04,51.31,29.13,20.23,17.67,16.98,88.68,62.26,58.49,7.55,3.77,0,0,1.89,0,1.89,3.77,9.43,7.55,0,16.98,18.87,3.77,7.55,0,22.64,0,0,7.55,0,7.55,0,15.09,0,15.09,7.55,0,0,1.89,0,5.66,0,3.77,1.89,1.89,1.89,0,1.89,1.89,0,0,0,13.21,0,0,0,0,0,0,5.66,0,0,0,0,0,0,0,0,0,0,0,0,0,0,0,0,0,0,0,0,0,0,0,0,0,0,0,0,0,1.89,0,0,13.21,1.89,0,1.89,0,0,0,0,0,0,7.55,1.89,0,0,0,0,0,5.66,5.66,0,0,0,0,0,0
6/11/24 12:32,374,0,"The phrase could refer to ""God"" and what was his/her intent when we were placed on earth. It could also refer to a philosophical question concerning why are we on this earth. Finally it could be referring to physical life and what we should do to complete our lives.",Life,MeaningOf,1,50,5.22,99,1,,16.67,14,92,80,70,22,12,0,8,0,4,0,10,12,4,0,14,18,8,8,0,26,2,0,8,8,0,0,20,0,20,2,4,8,2,0,0,0,0,0,0,0,0,0,0,0,0,0,22,8,0,0,0,0,2,12,0,0,2,2,0,0,0,0,2,0,0,0,0,2,4,0,0,0,0,0,0,0,0,0,0,0,0,2,0,0,0,0,2,4,0,0,4,0,0,0,4,6,4,0,0,0,0,0,0,12,6,0,0,0,0,6,0
6/11/24 12:36,117,0,the thing a word represents would probably be the best way i could personally describe it. what something means is just the definition that we add to its existence lol. i dont think i have anything else to say for another sentence,Word,MeaningOf,1,42,7.34,4.61,39.59,,14,23.81,92.86,83.33,66.67,28.57,9.52,7.14,2.38,0,0,0,19.05,16.67,9.52,0,7.14,14.29,7.14,0,2.38,26.19,4.76,4.76,4.76,2.38,2.38,0,26.19,0,26.19,7.14,0,4.76,7.14,0,4.76,0,0,0,0,0,0,0,0,0,0,0,9.52,7.14,0,0,0,0,7.14,2.38,0,0,0,0,0,0,0,0,0,0,0,0,0,0,0,0,0,0,0,0,0,0,0,0,0,0,0,0,0,0,0,0,4.76,2.38,0,0,2.38,0,0,0,0,0,9.52,0,2.38,2.38,0,0,0,4.76,4.76,0,0,0,0,0,0
6/11/24 12:34,284,0,"When people use ""a meaningful life"" I think that they are saying that their life has meaning. I don't know what kind of meaning they are refering to. I meaningful life could mean that they have accomplished there goals or it can be a meaningful life to serve others . Meaningful is too vague it could mean anything from making a good living to liveing a dream.",Life,Meaningful,1,66,12.37,17.46,86.68,99,16.5,15.15,95.45,75.76,59.09,22.73,10.61,4.55,0,0,0,6.06,12.12,12.12,6.06,0,9.09,15.15,4.55,3.03,1.52,24.24,7.58,0,3.03,0,3.03,0,33.33,0,30.3,15.15,3.03,4.55,4.55,0,4.55,0,10.61,10.61,0,1.52,1.52,0,0,0,0,0,13.64,1.52,0,0,0,0,1.52,6.06,0,0,0,0,0,0,0,0,1.52,0,0,1.52,0,0,1.52,0,0,0,0,0,0,0,0,0,0,0,0,0,0,1.52,0,0,16.67,3.03,0,0,3.03,0,0,0,1.52,0,9.09,0,0,0,0,0,0,10.61,6.06,0,0,0,1.52,3.03,0
6/11/24 12:36,162,0,"I think they are referring to three things: First, the functional purpose of a word's usage. Second, the significance(s) that a work evokes. And finally, the specific social connotations behind a word's usage in a particular society. All of these factors work together in order to bring about a greater understanding of the context of a word.",Word,MeaningOf,1,58,99,40.06,31.84,74.09,14.5,24.14,81.03,68.97,56.9,8.62,3.45,1.72,0,0,0,1.72,5.17,27.59,17.24,5.17,17.24,1.72,5.17,1.72,0,8.62,8.62,6.9,6.9,3.45,1.72,1.72,10.34,1.72,8.62,3.45,1.72,0,0,0,1.72,0,3.45,3.45,0,0,0,0,0,0,0,0,13.79,8.62,3.45,0,0,0,1.72,3.45,0,0,0,0,0,0,0,0,5.17,0,0,5.17,0,0,0,0,0,0,0,0,0,0,0,0,0,0,0,0,0,0,0,0,3.45,6.9,0,1.72,5.17,0,0,0,1.72,0,1.72,0,0,0,0,0,0,20.69,6.9,5.17,0,0,3.45,5.17,0
6/11/24 12:35,216,0,"What is the foundation of life, the reasons for it. What does it mean to be alive and what matters about it. Meaning has intention and purpose so the meaning of life would mean that being alive in itself has intention, matter and it has a purpose.",Life,MeaningOf,1,47,20.01,,8.74,,15.67,19.15,100,70.21,65.96,19.15,0,0,0,0,0,0,19.15,10.64,8.51,0,12.77,17.02,4.26,8.51,0,17.02,4.26,0,0,0,0,0,25.53,0,25.53,10.64,10.64,2.13,0,0,0,0,0,0,0,0,0,0,0,0,0,0,4.26,0,0,0,0,0,0,0,0,0,0,0,0,0,0,0,2.13,0,0,2.13,0,0,4.26,4.26,0,0,0,0,0,0,0,0,0,0,0,0,0,0,0,0,8.51,2.13,0,0,2.13,0,0,0,0,0,10.64,0,0,0,0,0,0,10.64,6.38,4.26,0,0,0,0,0
6/11/24 12:37,81,0,"A meaningful word is a word that is significant to people and in the context of the sentence it is used.  For example, ""independence"" would be one of these words.  A young person could say that they crave independence from their parents and this would be a very meaningful word for them.",Word,Meaningful,1,52,64.84,73.15,1.31,79.29,17.33,17.31,94.23,76.92,63.46,15.38,5.77,0,0,0,0,5.77,9.62,23.08,11.54,1.92,13.46,15.38,1.92,3.85,0,21.15,7.69,1.92,1.92,1.92,0,0,15.38,0,15.38,3.85,1.92,5.77,0,0,3.85,0,3.85,3.85,0,0,0,0,0,0,0,0,19.23,9.62,0,0,0,0,9.62,9.62,1.92,0,0,0,0,0,0,0,0,0,0,0,0,0,0,0,0,0,0,0,0,0,0,0,1.92,0,0,0,0,0,0,0,1.92,1.92,0,0,1.92,0,0,0,1.92,1.92,5.77,0,0,0,0,0,0,11.54,5.77,1.92,0,0,0,3.85,0
6/11/24 12:37,99,0,"I believe they are talking about one's growth as a person. By asking the background that leads to their completion of a lifetime, it makes you feel acknowledged in a way that is admirable. As long as it describes one's growth, then it tells the meaning of life.",Life,MeaningOf,1,48,82.63,84.23,54.55,52.41,16,18.75,89.58,68.75,54.17,18.75,8.33,2.08,0,2.08,0,4.17,10.42,16.67,10.42,0,18.75,4.17,2.08,8.33,0,16.67,2.08,2.08,2.08,0,2.08,2.08,10.42,0,10.42,6.25,4.17,0,0,0,0,0,2.08,2.08,0,0,0,0,0,0,0,0,22.92,12.5,0,0,0,2.08,8.33,8.33,0,0,0,0,0,0,0,0,0,0,0,0,0,0,0,0,0,0,0,0,0,0,0,0,0,0,0,2.08,0,0,0,0,6.25,8.33,0,0,6.25,0,0,2.08,4.17,0,10.42,0,0,0,0,0,0,14.58,6.25,4.17,0,0,4.17,0,0
6/11/24 12:36,147,0,"I think what people are talking about when they talk about ""a meaningful life"" is when they are on their deathbed, will they be happy with the choices they have made and the life they have lived.  Its different for each person, but I believe that it is the same for each person in the sense that each person will know at the end of their life whether they were successful or not.  Its complicated, but the simple part if in each person's judgement at the end of their life.",Life,Meaningful,1,90,33.38,46.63,96.01,72.45,30,12.22,100,83.33,66.67,18.89,12.22,2.22,0,0,0,10,6.67,21.11,8.89,0,13.33,11.11,4.44,8.89,1.11,18.89,7.78,1.11,2.22,0,1.11,1.11,18.89,0,18.89,7.78,1.11,0,2.22,0,10,0,3.33,3.33,0,1.11,1.11,0,0,0,0,0,22.22,3.33,0,0,0,1.11,2.22,14.44,0,0,0,0,0,0,0,0,0,0,0,0,0,0,2.22,0,0,0,0,0,0,0,1.11,0,0,0,0,0,0,1.11,0,0,11.11,4.44,0,0,3.33,0,0,1.11,4.44,3.33,4.44,2.22,0,0,0,0,0,10,3.33,3.33,0,0,1.11,2.22,0
6/11/24 12:38,83,0,"When they use that phrase, they typically are talking about having a purpose in their lives to follow. This can be a specific purpose, like raising a child, or general purpose, like just experiencing having a family. The meaning of life gives a person's life value and purpose.",Life,MeaningOf,1,48,67.92,84.23,3.81,,16,25,91.67,70.83,56.25,10.42,6.25,0,0,0,0,6.25,4.17,18.75,12.5,0,12.5,10.42,8.33,6.25,0,20.83,4.17,0,0,0,0,0,18.75,0,18.75,2.08,10.42,2.08,4.17,0,2.08,0,0,0,0,0,0,0,0,0,0,0,16.67,2.08,0,0,0,0,2.08,10.42,0,0,0,0,0,0,0,0,0,0,0,0,0,0,2.08,0,0,0,0,0,0,0,0,0,0,0,0,0,0,0,0,0,12.5,4.17,0,0,4.17,0,0,0,2.08,0,8.33,0,0,0,0,0,0,16.67,6.25,8.33,0,0,2.08,0,0
6/11/24 12:37,102,0,"I believe they are talking about a purpose to life in general.  Not specifically about an individual life, but rather the purpose of life existing at all.  It seems to reference something beyond the mere fact of existence, as if there is some sort of goal for life to exist in the universe.",Life,MeaningOf,1,53,96.59,8.26,55.39,49.04,17.67,22.64,90.57,71.7,60.38,7.55,3.77,1.89,0,0,0,1.89,3.77,13.21,9.43,0,26.42,3.77,9.43,5.66,1.89,9.43,3.77,5.66,1.89,0,1.89,0,24.53,1.89,22.64,3.77,3.77,0,15.09,0,5.66,0,1.89,1.89,0,0,0,0,0,0,0,0,15.09,3.77,0,0,0,0,1.89,1.89,0,0,0,0,0,0,0,0,1.89,0,0,1.89,0,0,0,0,0,0,0,0,0,0,0,0,0,0,0,0,0,1.89,0,0,7.55,7.55,0,0,7.55,0,0,0,0,0,5.66,0,0,0,0,0,0,9.43,5.66,3.77,0,0,0,0,0
6/11/24 12:37,128,0,When people use this word they are trying to explain what a word represents. Another way to phrase this is what a word is trying to communicate. I believe people are trying to provide not only the definition but how a word can make somebody feel.,Word,MeaningOf,1,46,28.85,10.88,29.9,,15.33,17.39,97.83,76.09,56.52,17.39,4.35,2.17,0,0,0,2.17,13.04,15.22,8.7,0,8.7,10.87,6.52,4.35,2.17,30.43,2.17,2.17,6.52,0,6.52,0,34.78,0,34.78,10.87,6.52,8.7,2.17,0,6.52,0,0,0,0,0,0,0,0,0,0,0,19.57,15.22,0,0,0,0,13.04,4.35,0,0,0,0,0,0,0,0,0,0,0,0,0,0,0,0,0,0,0,0,0,0,0,0,0,0,0,0,0,0,0,0,8.7,4.35,0,0,2.17,0,0,2.17,2.17,0,17.39,0,0,0,0,0,0,6.52,6.52,0,0,0,0,0,0
6/11/24 12:36,183,0,I think they mean a word that is important to them and means a lot to them. Words like love are meaningful because they are special and aren't said often. So I think a meaningful word is a special word that means a lot to the people we share it with,Word,Meaningful,1,51,35.2,63.27,73.43,99,17,11.76,100,84.31,64.71,19.61,13.73,3.92,1.96,0,0,7.84,5.88,19.61,11.76,0,9.8,9.8,3.92,7.84,1.96,19.61,9.8,3.92,3.92,3.92,0,0,19.61,0,19.61,13.73,1.96,0,1.96,0,1.96,0,7.84,7.84,0,1.96,1.96,0,0,0,0,0,23.53,13.73,0,0,0,0,9.8,9.8,0,0,0,0,0,0,0,0,0,0,0,0,0,0,0,0,0,0,0,0,0,0,0,0,0,0,0,0,0,0,0,0,11.76,0,0,0,0,0,0,0,1.96,1.96,13.73,0,0,0,0,0,0,5.88,3.92,0,0,0,1.96,0,0
6/11/24 12:35,248,0,"Maybe the word doesn't just have a simple meaning.  It's not just a simple slang or filler word.  The meaning has to be explained.  The definition of the word itself may also be something important to someone.  I think maybe some meaningful words might be love, compassion, soulmate, kindness, or maybe something beautiful/poetic sounding.",Word,Meaningful,1,55,17.1,8.91,50.45,99,11,25.45,94.55,74.55,60,10.91,1.82,1.82,0,0,0,0,9.09,12.73,10.91,0,7.27,16.36,10.91,5.45,3.64,23.64,9.09,1.82,3.64,3.64,0,0,36.36,0,36.36,10.91,0,0,18.18,5.45,5.45,0,12.73,12.73,0,1.82,1.82,0,0,0,0,0,18.18,14.55,3.64,0,0,0,7.27,3.64,0,1.82,0,0,0,0,0,0,0,0,0,0,0,0,0,0,0,0,0,0,0,0,0,0,0,0,0,0,0,0,0,0,9.09,1.82,0,0,0,0,1.82,0,0,1.82,3.64,9.09,0,0,0,0,0,21.82,9.09,7.27,0,0,3.64,1.82,0
6/11/24 12:35,243,0,"A meaningful word can be a word that someone uses in order to show their sincerity. It could be a word that has a special meaning, or a certain connotation within the context of the usage. It might be a word that only the speaker (or writer) uses that the other person, or people, know from their relationship with that person, has a special meaning.",Word,Meaningful,1,65,74.95,67.13,14.57,68.66,21.67,18.46,93.85,72.31,61.54,15.38,3.08,0,0,0,0,3.08,12.31,29.23,16.92,0,9.23,12.31,1.54,4.62,0,16.92,9.23,0,3.08,1.54,0,1.54,21.54,0,21.54,6.15,3.08,3.08,7.69,0,6.15,0,3.08,3.08,0,0,0,0,0,0,0,0,18.46,7.69,1.54,0,0,1.54,6.15,10.77,0,0,0,0,0,0,0,0,1.54,0,0,1.54,0,0,0,0,0,0,0,0,0,0,0,0,0,0,0,0,0,0,0,0,6.15,4.62,0,0,3.08,1.54,0,0,0,0,7.69,1.54,0,0,0,0,0,13.85,4.62,6.15,0,0,0,3.08,0
6/11/24 12:37,134,0,It could mean that life of a person has a purpose and a direction in which one moves. There is a clear direction of life. It could as well include having all that makes life worth living,Life,Meaningful,1,37,51.04,40.06,36.48,62.77,12.33,10.81,100,72.97,62.16,13.51,0,0,0,0,0,0,13.51,21.62,10.81,2.7,10.81,13.51,5.41,5.41,0,21.62,2.7,5.41,0,0,0,0,18.92,2.7,16.22,2.7,5.41,5.41,0,0,2.7,0,2.7,2.7,0,0,0,0,0,0,0,0,10.81,0,0,0,0,0,0,2.7,0,0,0,0,0,0,0,0,2.7,0,0,0,2.7,0,2.7,0,0,0,0,0,0,0,0,0,0,0,0,0,0,0,0,0,10.81,16.22,0,2.7,13.51,0,0,0,0,0,8.11,0,0,0,0,0,0,5.41,5.41,0,0,0,0,0,0
6/11/24 12:35,271,0,The purpose of life and the reason why you do what you do in every day life. What life means to me and what drives me to succeed. Why someone exists and makes the choices they make.,Life,MeaningOf,1,37,27.81,91.56,73.75,62.77,12.33,10.81,97.3,78.38,64.86,24.32,13.51,5.41,0,5.41,0,2.7,10.81,10.81,8.11,0,10.81,5.41,5.41,8.11,0,16.22,0,5.41,2.7,0,2.7,0,27.03,2.7,24.32,8.11,16.22,0,2.7,0,0,0,2.7,2.7,0,0,0,0,0,0,0,0,18.92,0,0,0,0,0,0,10.81,0,0,0,0,0,0,0,0,0,0,0,0,0,0,0,0,0,0,0,0,0,0,0,0,0,0,0,0,0,2.7,0,0,13.51,5.41,0,2.7,2.7,0,0,0,2.7,0,8.11,0,0,0,0,0,0,8.11,8.11,0,0,0,0,0,0
6/11/24 12:38,116,0,"Meaning when used in context to describe a word, is used to give the defination of the word being described.  However, since words are known to have different meanings depending on their useage, it is sometimes important to tell people how you are intending the word to be understood in the context it is given.  Isn't English a wonderful language?  So confusing that we have to tell you what we ""mean"" when using a word.",Word,MeaningOf,1,75,51.7,77.41,63.35,39.67,18.75,24,93.33,72,56,12,6.67,0,2.67,2.67,0,1.33,5.33,12,9.33,0,14.67,13.33,6.67,6.67,1.33,26.67,4,0,2.67,2.67,0,0,22.67,0,22.67,8,9.33,0,4,0,4,0,4,2.67,1.33,2.67,1.33,1.33,0,0,0,0,21.33,14.67,0,0,0,0,12,6.67,0,0,0,0,0,0,0,0,0,0,0,0,0,0,0,0,0,0,0,0,0,0,0,2.67,0,0,0,0,0,0,0,0,5.33,2.67,0,0,2.67,0,0,0,5.33,6.67,9.33,2.67,0,0,0,0,0,13.33,4,4,1.33,0,1.33,2.67,0
6/11/24 12:35,304,0,To me this describes a word that has depth and importance to the person.  This could be relevant to their past or maybe something in literature that they find to be important.  It makes them feel something.,Word,Meaningful,1,37,15.89,71.32,55.76,62.77,12.33,18.92,94.59,83.78,67.57,29.73,10.81,2.7,0,0,0,8.11,18.92,18.92,5.41,0,13.51,10.81,2.7,5.41,0,18.92,5.41,2.7,0,0,0,0,24.32,0,24.32,8.11,2.7,2.7,10.81,0,2.7,0,2.7,2.7,0,0,0,0,0,0,0,0,16.22,5.41,0,0,0,0,5.41,10.81,0,0,0,0,0,0,0,0,0,0,0,0,0,0,0,0,0,0,0,0,0,0,0,0,0,0,0,0,0,0,0,0,5.41,10.81,0,0,5.41,0,0,2.7,2.7,2.7,8.11,0,0,0,0,0,0,8.11,8.11,0,0,0,0,0,0
6/11/24 12:32,495,0,"Making our lives rich
Fullfills a need in our lives
something that is important to us and can cause us to reflect on our lives or actions
can give us pleasure ,raise our self esteem and make us feel valuable to someone",Word,Meaningful,1,42,23.27,99,12.96,99,42,19.05,92.86,80.95,54.76,26.19,19.05,0,19.05,0,0,0,7.14,14.29,2.38,0,11.9,7.14,0,7.14,0,26.19,7.14,0,21.43,19.05,0,2.38,26.19,0,26.19,4.76,7.14,7.14,7.14,0,2.38,0,9.52,9.52,0,2.38,2.38,0,0,0,0,0,26.19,2.38,0,0,0,0,0,23.81,0,0,0,0,0,0,0,0,2.38,0,0,0,2.38,0,7.14,0,0,0,0,0,0,0,0,2.38,0,0,0,0,0,0,0,0,9.52,16.67,0,2.38,9.52,2.38,0,2.38,0,0,19.05,0,0,0,0,0,0,2.38,0,2.38,0,0,0,0,0
6/11/24 12:37,148,0,"In my opinion the phrase ""a meaningful life"" can be open to interpretation. It can mean a life that the person themselves feels is lived with purpose. It can also be looked at by others based on acts of service to community or family.",Life,Meaningful,1,44,76.99,40.06,50.45,55.62,14.67,15.91,95.45,72.73,59.09,13.64,4.55,2.27,0,0,0,2.27,9.09,13.64,9.09,0,18.18,13.64,2.27,4.55,0,25,4.55,0,2.27,2.27,0,0,27.27,0,27.27,11.36,4.55,6.82,2.27,0,4.55,0,2.27,2.27,0,0,0,0,0,0,0,0,13.64,2.27,0,0,0,0,2.27,6.82,0,0,0,0,0,0,0,0,2.27,0,0,2.27,0,0,2.27,0,0,0,0,0,0,0,0,0,0,0,0,0,0,0,0,0,11.36,11.36,0,0,6.82,2.27,0,2.27,0,4.55,11.36,0,0,0,0,0,0,11.36,6.82,0,0,0,0,4.55,0
6/11/24 12:36,249,0,"The meaning of a word usually pertains to the word's definition or a synonym that hits hits hits the criteria needed to get a feel of that word.  My apologies, Artemis is infectious.",Word,MeaningOf,1,33,98.44,12.22,29.49,1,16.5,27.27,84.85,57.58,48.48,9.09,3.03,3.03,0,0,0,0,6.06,27.27,18.18,0,12.12,3.03,3.03,3.03,0,12.12,0,0,3.03,0,0,3.03,18.18,0,18.18,9.09,0,3.03,6.06,0,3.03,0,9.09,0,9.09,0,0,0,0,0,0,0,9.09,9.09,3.03,3.03,0,0,6.06,0,0,0,0,0,0,0,0,0,0,0,0,0,0,0,3.03,3.03,3.03,0,0,0,0,0,0,3.03,0,3.03,0,0,0,0,0,0,6.06,3.03,0,0,0,0,0,3.03,3.03,3.03,6.06,0,0,0,0,0,0,12.12,6.06,3.03,0,0,3.03,0,0
6/11/24 12:38,148,0,"This is a referring to once's life having meaning, being relevant. This may mean that they find their life fulfilling, where the outcome matches their aspirations, in a ""mission accomplished"" kind-of-way.",Life,Meaningful,1,31,41.62,88.59,35.88,97.31,15.5,32.26,87.1,61.29,51.61,19.35,9.68,0,0,0,0,9.68,9.68,25.81,9.68,0,6.45,12.9,3.23,0,0,19.35,3.23,0,9.68,0,9.68,0,25.81,0,25.81,12.9,3.23,3.23,3.23,0,0,0,6.45,6.45,0,0,0,0,0,0,0,0,19.35,3.23,0,0,0,0,0,9.68,0,0,0,0,0,0,0,0,3.23,0,0,3.23,0,0,0,0,0,0,0,0,0,0,0,0,3.23,0,0,3.23,0,0,0,0,12.9,9.68,0,0,6.45,0,0,0,0,0,3.23,3.23,0,0,0,0,0,32.26,6.45,9.68,0,0,3.23,12.9,0
6/11/24 12:33,416,0,"When people use the phrase ""the meaning of life"" I expect that they are talking about ""purpose"" and allude to a sense (or lack of) hope. It sounds like a phrase used for the general population, but I think people use it to express their own personal values, and can be self-centered. Common answers to ""the meaning of life"" would be ""YOLO"" or fun focused; loving one another; or even nihilistic views where there is no meaning.",Life,MeaningOf,1,77,45.12,20.1,32.28,79.89,25.67,18.18,89.61,68.83,54.55,11.69,6.49,2.6,0,1.3,0,2.6,5.19,14.29,7.79,1.3,11.69,7.79,7.79,9.09,1.3,16.88,5.19,2.6,1.3,0,0,1.3,25.97,1.3,24.68,7.79,5.19,5.19,5.19,0,6.49,0,3.9,3.9,0,3.9,3.9,0,0,0,0,0,11.69,3.9,1.3,0,0,0,2.6,5.19,0,0,0,0,0,0,0,0,1.3,1.3,0,0,0,0,0,0,0,0,0,0,0,0,0,0,1.3,0,1.3,0,0,0,0,0,9.09,7.79,1.3,0,2.6,1.3,1.3,1.3,1.3,1.3,3.9,2.6,1.3,1.3,0,0,0,23.38,3.9,2.6,0,0,0,16.88,0
6/11/24 12:39,80,0,I think they are talking about a life that brings them pleasure. Or a life that to that person has a purpose. They could be thinking about a life that fulfills them and makes them happy.,Life,Meaningful,1,36,14.43,92.24,10.18,93.93,12,13.89,100,80.56,63.89,27.78,16.67,2.78,0,0,0,13.89,11.11,22.22,11.11,0,8.33,11.11,5.56,5.56,0,25,2.78,0,2.78,0,2.78,0,16.67,0,16.67,5.56,5.56,2.78,2.78,0,2.78,0,5.56,5.56,0,5.56,5.56,0,0,0,0,0,30.56,5.56,0,0,0,0,2.78,16.67,0,0,0,0,0,0,0,0,0,0,0,0,0,0,0,0,0,0,0,0,0,0,0,0,0,0,0,2.78,0,0,0,0,8.33,2.78,0,2.78,0,0,0,0,0,0,11.11,0,0,0,0,0,0,8.33,8.33,0,0,0,0,0,0
6/11/24 12:40,49,0,"When people refer to ""a meaningful word,"" they often mean a word that carries significant weight or importance, conveying a specific, impactful message. It could be a word that evokes strong emotions or has a profound resonance in a particular context. For instance, words like ""love,"" ""freedom,"" or ""hope"" are considered meaningful because they encapsulate complex concepts and feelings that resonate deeply with many people.",Word,Meaningful,1,65,66.97,23.73,73.25,99,21.67,35.38,89.23,64.62,44.62,9.23,3.08,0,0,0,0,3.08,6.15,15.38,9.23,0,7.69,6.15,3.08,9.23,0,12.31,13.85,3.08,1.54,0,0,1.54,26.15,0,26.15,10.77,3.08,3.08,7.69,0,6.15,0,12.31,10.77,0,4.62,3.08,0,0,0,0,0,15.38,12.31,0,0,0,0,9.23,3.08,0,0,0,0,0,0,0,0,0,0,0,0,0,0,0,0,0,0,0,0,0,0,0,0,1.54,0,0,0,0,0,0,0,7.69,4.62,0,1.54,1.54,0,0,1.54,4.62,1.54,4.62,1.54,0,0,0,0,0,26.15,4.62,9.23,0,0,0,12.31,0
6/11/24 12:39,90,0,"Meaningful, to me, means it can relate to something significant in my life. It can be either positive or negative, but it must have a strong effect. It can also evoke nostalgic memories or relationships.",Word,Meaningful,1,35,2.35,1,42.95,65.27,11.67,22.86,97.14,80,62.86,20,5.71,5.71,0,0,0,0,14.29,8.57,2.86,0,8.57,17.14,2.86,14.29,0,20,17.14,0,5.71,2.86,0,2.86,45.71,0,45.71,11.43,2.86,14.29,8.57,5.71,11.43,5.71,11.43,5.71,2.86,2.86,0,0,0,0,0,0,5.71,0,0,0,0,0,0,2.86,0,0,0,0,0,0,0,0,0,0,0,0,0,0,0,0,0,0,0,0,0,0,0,0,0,0,0,0,0,0,0,0,2.86,2.86,0,0,2.86,0,0,0,0,5.71,11.43,0,0,0,0,0,0,17.14,8.57,8.57,0,0,0,0,0
6/11/24 12:39,73,0,"Meaning of life means what we strive to live for. Its like why we keep on fighting to live. Not to go deep, but everyone could kill themselves, but they wont because meaning of life.",Life,MeaningOf,1,35,39.7,72.87,97.09,20.23,11.67,17.14,100,80,62.86,20,11.43,0,5.71,0,0,5.71,8.57,2.86,0,0,22.86,5.71,2.86,8.57,5.71,20,2.86,0,11.43,5.71,2.86,2.86,28.57,2.86,25.71,8.57,5.71,2.86,0,0,8.57,0,11.43,5.71,5.71,0,0,0,0,0,0,0,25.71,5.71,0,0,5.71,0,0,14.29,0,0,0,0,0,0,0,0,0,0,0,0,0,0,8.57,0,0,0,0,0,0,0,2.86,0,2.86,0,0,0,0,0,0,0,20,11.43,0,2.86,11.43,0,0,0,0,0,2.86,2.86,0,0,0,0,0,14.29,8.57,5.71,0,0,0,0,0
6/11/24 12:36,253,0,"This phrase relates to the reason why humans exist--more generally, and what do humans contribute to the life experience. More personally, what is the reason I am here on the planet, and what should I be doing, creating, being involved in to make it better?  This is a very old query that has been examined by philosophers since the ancient Greeks.  The response will vary according to the times (dates) in which it is asked.",Life,MeaningOf,1,76,48.35,25.84,70.28,39.38,19,15.79,89.47,72.37,63.16,14.47,2.63,2.63,0,0,0,0,11.84,17.11,10.53,0,11.84,15.79,5.26,3.95,0,21.05,6.58,2.63,2.63,0,2.63,0,17.11,0,17.11,6.58,7.89,1.32,1.32,0,2.63,0,1.32,1.32,0,0,0,0,0,0,0,0,7.89,3.95,1.32,0,0,0,2.63,2.63,0,0,0,0,1.32,0,1.32,0,0,0,0,0,0,0,0,0,0,0,0,0,0,0,0,0,0,0,0,0,0,0,0,2.63,5.26,5.26,1.32,0,3.95,0,0,0,6.58,3.95,6.58,1.32,0,0,0,0,0,17.11,3.95,6.58,1.32,0,0,5.26,0
6/11/24 12:35,363,0,"It is the actual definition of the word.  It also helps to determine how it is used in a sentence (noun verb etc.) that assists in the ""meaning"" of the word. It is also the thing that a person wants other people to understand.",Word,MeaningOf,1,44,81.89,40.06,34.4,55.62,11,13.64,90.91,75,61.36,15.91,0,0,0,0,0,0,15.91,22.73,15.91,0,13.64,6.82,6.82,4.55,0,18.18,4.55,0,2.27,2.27,0,0,18.18,0,18.18,11.36,4.55,2.27,0,0,2.27,0,2.27,2.27,0,0,0,0,0,0,0,0,11.36,9.09,4.55,0,0,0,4.55,2.27,0,0,0,0,0,0,0,0,0,0,0,0,0,0,0,0,0,0,0,0,0,0,0,0,2.27,0,0,0,0,0,0,0,2.27,4.55,0,0,4.55,0,0,0,0,2.27,11.36,2.27,0,0,0,0,0,18.18,9.09,0,0,0,0,9.09,0
6/11/24 12:40,52,0,"Meaning is how one interprets a word. What does that word stand for or symbolize? It's the associations that one makes with a word that really defines the ""meaning"" behind it.",Word,MeaningOf,1,31,51.31,23.05,91.84,,10.33,19.35,96.77,70.97,64.52,19.35,0,0,0,0,0,0,19.35,29.03,12.9,6.45,9.68,9.68,6.45,3.23,0,16.13,0,6.45,3.23,3.23,0,0,25.81,0,25.81,16.13,6.45,0,3.23,3.23,3.23,0,0,0,0,0,0,0,0,0,0,0,12.9,12.9,0,0,0,0,12.9,0,0,0,0,0,0,0,0,0,0,0,0,0,0,0,0,0,0,0,0,0,0,0,0,0,0,0,0,0,0,0,0,0,0,6.45,0,0,6.45,0,0,0,0,0,16.13,0,0,0,0,0,0,19.35,6.45,0,3.23,0,3.23,6.45,0
6/11/24 12:34,395,0,"The philosophical significance of existence
People ask themselves why am I here
They also ask what is my purpose , they search for lifes purpose
They could also have religious beliefs that give them a sense of the meaning of life",Life,MeaningOf,1,40,15.41,81,15.38,,40,22.5,90,70,60,22.5,17.5,5,0,0,0,12.5,5,12.5,7.5,0,10,10,10,5,0,17.5,2.5,0,0,0,0,0,17.5,0,17.5,7.5,7.5,2.5,0,0,0,0,0,0,0,0,0,0,0,0,0,0,22.5,7.5,0,0,0,0,5,12.5,0,0,0,0,0,0,0,0,2.5,0,0,0,0,2.5,0,0,0,0,0,0,0,0,0,0,0,0,0,0,0,0,0,5,12.5,10,5,0,2.5,0,0,2.5,0,0,7.5,0,0,0,0,0,0,5,0,2.5,0,0,2.5,0,0
6/11/24 12:38,175,0,They are referring to the sense of the word.  The meaning of a word has a concrete definition but can sometimes be used in different contexts.  The meaning of a word often brings to mind a picture in our head of the meaning of the word.,Word,MeaningOf,1,46,99,53.04,85.35,53.96,15.33,21.74,97.83,69.57,58.7,4.35,4.35,0,2.17,0,0,2.17,0,23.91,21.74,0,19.57,8.7,2.17,2.17,0,15.22,4.35,0,2.17,2.17,0,0,28.26,0,28.26,10.87,2.17,2.17,4.35,0,4.35,0,2.17,2.17,0,0,0,0,0,0,0,0,17.39,13.04,0,0,0,0,8.7,4.35,0,0,0,0,0,0,0,0,0,0,0,0,0,0,2.17,0,0,0,0,0,0,0,0,0,0,0,0,0,0,0,0,0,0,10.87,0,2.17,4.35,2.17,0,2.17,4.35,2.17,8.7,0,0,0,0,0,0,6.52,6.52,0,0,0,0,0,0
